product_name,product_price,Rate,Summary,Review,Sentiment
"Crompton 75 L Desert Air Cooler??????(White, Teal, ACGC-DAC751)",9999,5,highly recommended,its a very good cooler cooling capacity is very good the best thing is that i have moving the cooler with full capacity 88l from one place to another i have used the ice chamber only once then i dont used the ice chamber bcoz the cooling capacity is very good and u dont need the ice after used 10days i have post my review without any 2nd thinking go for it,positive
"Crompton 75 L Desert Air Cooler??????(White, Teal, ACGC-DAC751)",9999,5,excellent,awesome productafter comparing with various brands like symphony usha orient i have chosen this i got this for 7600 works efficiently by placing it in a good ventilation area and run at low speed for better cooling can go for it without any second thought and you wont regret your decision,positive
"Crompton 75 L Desert Air Cooler??????(White, Teal, ACGC-DAC751)",9999,5,perfect product!,best of bestits a king of desert cooler plastic could have been better but thats not at all issue you can close your eyes and hit buy button very less noise great air delivery best cooling with 4 way deflection you may need extra extension board for this moving such heavy tank is easy on wheels there is lock too just beware of children at home they can easily put handfingers inside,positive
"Crompton 75 L Desert Air Cooler??????(White, Teal, ACGC-DAC751)",9999,5,just wow!,crompton ozone 88 cooler was amazing we are fully satisfiedthanks to flipkartoverall experience is good value for money i recommend to everyone that you can buy this cooler without any doubt,positive
"Crompton 75 L Desert Air Cooler??????(White, Teal, ACGC-DAC751)",9999,3,decent product,good air delivery this is its pro and con because of heavy air delivery you cannot use this as fan otherwise this is very good if you live in hot dessert area do not buy if you are from humid coastal area it is not effective by a powerful fan instead,positive
"Crompton 75 L Desert Air Cooler??????(White, Teal, ACGC-DAC751)",9999,5,perfect product!,cooler is excellant giving air upto 15 feet in the room size 1215 feetgood design with no water leaks 3speeds even good cooling at lowest speed and used in summer with 40 deg c noise is morebut bearable honey comb mat is added advantageas per specs it consumes 190 wattsmovement is easy with castor wheels electric chord length is only one meteroverall best cooler in its range recommanded to othersi a rao,positive
"Crompton 75 L Desert Air Cooler??????(White, Teal, ACGC-DAC751)",9999,3,good,have been using for almost a month now one thing you definitely need to know is keep the cooler where fresh air ventilation is there otherwise the room will just become humid the cooling for me has not been that great dont know exactly how it provides maximum cooling and not make the room more humid using it in pune climate it partially does the job for me if anyone has had good experience with the product can help me out on how the maximum cooling can be achieved,positive
"Crompton 75 L Desert Air Cooler??????(White, Teal, ACGC-DAC751)",9999,5,simply awesome,best product packing and delivery i love this product i am totally satisfied with this product honey comb pad is good for extra cooling at this price it is a good deal,positive
"Crompton 75 L Desert Air Cooler??????(White, Teal, ACGC-DAC751)",9999,5,terrific,though the product is very good but the flipkart service is not upto the markfirst they sent me a damaged product with case openno shrink wrapbroken plugmultiple damageseven though there is a replacement policy it took time and my patience to deliver good producti fully recommend to buy this product but not from flipkart,positive
"Crompton 75 L Desert Air Cooler??????(White, Teal, ACGC-DAC751)",9999,5,great product,excellent buy was a bit hesitant seeing the negative reviews even in the hottest day this cooler keeps the room cool with ltl ice added from the top tray have been using for few weeks and very satisfied with the purchase,positive
"Crompton 75 L Desert Air Cooler??????(White, Teal, ACGC-DAC751)",9999,5,perfect product!,writing review after 1 week usage this is brilliant cooler at the price i got this for 7600 after bank discount looks brilliant with white and blue color combination easy to move and cools nicely i will recommend to buy this,positive
"Crompton 75 L Desert Air Cooler??????(White, Teal, ACGC-DAC751)",9999,4,delightful,good product by crompton and flipkart delivery is good product delivered with original packing same as given specification i am satisfy with product cooling is good air delivery also nice thank you flipkart,positive
"Crompton 75 L Desert Air Cooler??????(White, Teal, ACGC-DAC751)",9999,5,just wow!,i am writing this review after using cooler for a month i would say it is silent enough it cool down your bed room within 1520 mins so you can put it on before going to room as of now i am running it on level on and most of the time i have to switch pump off in mid night as you start feeling cold very effective cooling and run well on inverter excellent build quality you may feel fishy smell for few days but it will go off once you change water,positive
"Crompton 75 L Desert Air Cooler??????(White, Teal, ACGC-DAC751)",9999,5,worth every penny,best in the classextremely light and awesome looks and very easy to maneuver around thanks to the 4 wheels at each corner with wheel locking feature talking about its main function that is cooling so let me tell you it worth every penny and cools the room in around 10 min of medium size it got 5 iron blades which works fine and tank capacity is very large i would recommend go for the lower capacity which would cost 1000 rupees less,positive
"Crompton 75 L Desert Air Cooler??????(White, Teal, ACGC-DAC751)",9999,5,terrific,excellent cooler i was actually looking for a plastic body beautifull looking air cooler which can replace iron body exhaust fan cooler in my 500 sqr ft hall though no cooler can really replace the exhaust fan cooler but after using it for a week i can say that this cooler is the best among all and have excellent air throw with high cooling with no noise level and nice looks i purchased it after a lot of research and i am happy with the performance only better option is crompton optimu,positive
"Crompton 75 L Desert Air Cooler??????(White, Teal, ACGC-DAC751)",9999,3,just okay,writing this review after using this cooler for 4 months in nagpur where temperature goes till 48 degrees and is an extremely hot regionlight weight sturdy stylish does not make a lot of noise either this cooler will work absolutely fine until march but during the months of april and may when summer will be at its peak it will work only as a personal cooler and youll have to keep it hardly 1 meter away from yourself to feel the cool air,positive
"Crompton 75 L Desert Air Cooler??????(White, Teal, ACGC-DAC751)",9999,4,nice product,this is a cooler so please do not expect ac like cooling this provides good amount of cold air the room may become humid in placesregions with higher humidity so please use cross ventilation this is a value for money product and it is pretty big looks very good in room the air throw is sufficient for rooms with 150250 sqft size the delivery was good and the delivery personnel went out of his way to help get the huge package to 2nd floor thanks a lot,positive
"Crompton 75 L Desert Air Cooler??????(White, Teal, ACGC-DAC751)",9999,4,cools well but the user manual can be improved,the cooler was home delivered it came in good condition the cooler operation is simple the wheels are sturdy and it is easy to move around the main problem is with the manual the manual does not give details on how to clean the filters and how to drain the water tank the manufacturer could have created a simple youtube video on how to do this and not left it to the amateurs,positive
"Crompton 75 L Desert Air Cooler??????(White, Teal, ACGC-DAC751)",9999,5,worth every penny,its excellentwill feel some odour for 1 or 2 days due to honeycomb but then the smell will gopls dont forget to have some space behind cooler otherwise humidity will increase i felt the same but when i changed locationit if giving wonderful resultsrequires ac comforters after 2 hourswater tank capacity is good and it will last for more than whole night in continuous usewater level indicator is very clear wheels are good and locking system is also there overall worthy and good,positive
"Crompton 75 L Desert Air Cooler??????(White, Teal, ACGC-DAC751)",9999,5,worth every penny,giving this review after 4 months usage this is really good cooler cooling 1211 bedroom within 2 hours but proper ventilation should be there lit it sound is there i think the sound is common for all coolers this is good recommended to buy,positive
"Crompton 75 L Desert Air Cooler??????(White, Teal, ACGC-DAC751)",9999,5,simply awesome,wonderful product as expected reduces the room temperature nice air flow intial use will give a stink smell after first five hours everything seems to be normal ice chamber does its job for best results mix some ice while filling the tank cord length is small but manageable flipkart delivered in a week packing was perfect 5 for now will re review after few weeks,positive
"Crompton 75 L Desert Air Cooler??????(White, Teal, ACGC-DAC751)",9999,5,terrific,loved it excellent air thruogh i searched almost 15 days for best cooler finally got good one with reasonable price thanks to flipkart and crompton,positive
"Crompton 75 L Desert Air Cooler??????(White, Teal, ACGC-DAC751)",9999,1,unsatisfactory,air throw is very disappointingi thought it was a good cooler but its not they mentioned that it is for 450sq feet but it cant even cool my little 150sq feet room in 40 degree temp also i have tried all the way for ventilation but it always creates humidity and thats the bad part i suggest to dont buy this you can even buy a local brand cooler from the show which far better than this,negative
"Crompton 75 L Desert Air Cooler??????(White, Teal, ACGC-DAC751)",9999,4,worth the money,product is good with good look and compact designairflow is also good while considering for medium hallbut the problem is if you try to adjust ventsblades they will automatically bend downwards due to airforce it would be better if they stand still however we want,positive
"Crompton 75 L Desert Air Cooler??????(White, Teal, ACGC-DAC751)",9999,5,worth every penny,i have purchased this cooler from flipkart its an amazing products value for money you have to use blanket if you run this cooler at high speed even in hot hummid summer guys please go ahead and buy it this cooler can chilled a room size 400 to 500 sqft thank you flipkart i love this product,positive
"Crompton 75 L Desert Air Cooler??????(White, Teal, ACGC-DAC751)",9999,5,fabulous!,after use of one month very nice product work well less sound better cooling,positive
"Crompton 75 L Desert Air Cooler??????(White, Teal, ACGC-DAC751)",9999,5,excellent,its excellent product from crompton superb cooling without any sound light weight beautifully designed very good qualitythanks flipkart for amazing producti am satisfied with this purchase thanks a lot to seller and flipkart,positive
"Crompton 75 L Desert Air Cooler??????(White, Teal, ACGC-DAC751)",9999,1,did not meet expectations,it is old model and dont have outlet for draining dirty water we have to clean it manually and do lot of physical work usually the water becomes stinky once in a month we have to remove the screws and use motor to pump out the water the screws are not stainless steel so they get rusted easily and makes it difficult to remove the wheels get stuck within a month theres no manual how to remove and clean honeycomb the only positive point is its air throwing capacity and ability to cool,negative
"Crompton 75 L Desert Air Cooler??????(White, Teal, ACGC-DAC751)",9999,5,best in the market!,very good productreliable product from the brand not disappointed this tym after returning usha air king which was a wasteyou can go for this one for sure good air thrownice cooling ice chamber castor wheel evrythng working just great only one thing which i want to highlt is just the front louver the osclitor is good working perfectly but the front oscltor should hve been better overall great buy go for it,positive
"Crompton 75 L Desert Air Cooler??????(White, Teal, ACGC-DAC751)",9999,3,decent product,value for money but bit noisy good enough for large rooms need good air cross section water capacity is hugegood air throw noisy enough to keep outside cant watch tv while cooler is in room,positive
"Crompton 75 L Desert Air Cooler??????(White, Teal, ACGC-DAC751)",9999,1,don't waste your money,i baught this cooler looking at the number of reviews and rating as i always do and as expected cooler built quality is good but the main function of cooling has a design defect the water supplied through the channel has some design defect because of which none of the honeycomb panels gets wet completely and hence cooling effect is very less people may not have noticed this if they are from relatively not that hot places like pune mumbai or bangalore etc i would not recommend this product,negative
"Crompton 75 L Desert Air Cooler??????(White, Teal, ACGC-DAC751)",9999,5,terrific,very good product if you have a cross ventilation in your room so this product is so nice for you very less noise and give a instant cool air a little humidity fan speed is very good appropriate value for money,positive
"Crompton 75 L Desert Air Cooler??????(White, Teal, ACGC-DAC751)",9999,5,just wow!,it is a very good product you must buy it it has three side honeycomb pad and dis cooler gave a very nice air flow its exact height is 10 cm and you dont be hesitate to buy this product it has good swing and nice water tank of capacity 88 litres and i got a good delivery by flipkart and crompton is a good brand,positive
"Crompton 75 L Desert Air Cooler??????(White, Teal, ACGC-DAC751)",9999,3,just okay,not a great product the finishing of the product is not look like it is branded one just looks like ordinary roadside product not expected this type of product from crompton i have shared my view after 2 days of usage the 3 star is for its price go for symphony this is not trust worthy,negative
"Crompton 75 L Desert Air Cooler??????(White, Teal, ACGC-DAC751)",9999,4,good,good,positive
"Crompton 75 L Desert Air Cooler??????(White, Teal, ACGC-DAC751)",9999,3,fair,this product is very nice and good the motor was working good at very speed and very cool,positive
"Crompton 75 L Desert Air Cooler??????(White, Teal, ACGC-DAC751)",9999,5,awesome,excellent air cooling the water will last you easily for two nights n the cooling gets real effective if u place it near a window n yes just make sure you change ur water every week so to keep it clean n free from any smell its size is similar to ur 16 l fridge but much slimer n yeah thats all for now but will update my review soon after quarter year,positive
"Crompton 75 L Desert Air Cooler??????(White, Teal, ACGC-DAC751)",9999,5,great product,cooling is excellent even in large hall delivery of the product is really fast i got the item in 2days first time i am experiencing this fast delivery and packing of the product not good time god there is no damage found in coolercons1 cooling the room is very fast2 air flow also good3 fan blades are made by metal because of this blades doesnt bend while cooler is running4 motor is also made by crompton5 ice adding chamber also really cool6 coaster wheels are really,negative
"Crompton 75 L Desert Air Cooler??????(White, Teal, ACGC-DAC751)",9999,5,awesome,if placed in a well ventilated area the cooling of this desert cooler is pretty decent the water tank of 88 liter is enough for a full day continuous use built quality is robust the delivery experience was very good as the product was delivered with proper company packing and was handeled with care,positive
"Crompton 75 L Desert Air Cooler??????(White, Teal, ACGC-DAC751)",9999,5,terrific purchase,cooler is good but air up done setting is not good but all is ok i am happy you can purchase this cooler very nice product,positive
"Crompton 75 L Desert Air Cooler??????(White, Teal, ACGC-DAC751)",9999,5,brilliant,to be very honest with you i was a bit sceptical before buying this product wheather it will be able to live up to my expectationsbut after using this product for the last 5 months it has removed all the doubts i had yes a small shout to you guys over here its not a ac so dont expect it will cool the entire room within half an hour or it will work like a window ac and alli can share some tips which will definitely help you to get decent cooling experience make sure the water f,positive
"Crompton 75 L Desert Air Cooler??????(White, Teal, ACGC-DAC751)",9999,4,worth the money,this is honey comb cooler with giant water storagei have one thing like very much is that air throwi am satisfied with this coolerpros1good air throw2chill room quickly if good ventilation3invertel competiblecros1some time its make very humidity in roomit depends on climate2 in high speed its make very noise but adjustable,positive
"Crompton 75 L Desert Air Cooler??????(White, Teal, ACGC-DAC751)",9999,5,highly recommended,good product delivery boys good best coler thank you for filipcard,positive
"Crompton 75 L Desert Air Cooler??????(White, Teal, ACGC-DAC751)",9999,4,worth the money,received a replacement for previously delivered damaged product replacement process was hassle free kudos to that this is a good cooler for the price totally worthy of 4 starsprosvery good cooling effectgood breeze speed breeze can be felt even 15 feet awayconthe body is not very sturdy although it can not be called weak either,positive
"Crompton 75 L Desert Air Cooler??????(White, Teal, ACGC-DAC751)",9999,1,did not meet expectations,not a good body delivery of this product is not safe it get break working is also not good,negative
"Crompton 75 L Desert Air Cooler??????(White, Teal, ACGC-DAC751)",9999,4,pretty good,doesnt look that much fancy but rest when it comes to work it super and never water drop from its windows,positive
"Crompton 75 L Desert Air Cooler??????(White, Teal, ACGC-DAC751)",9999,5,highly recommended,very good and fantastic purchase i love it crompton is a brand and its quality meet brand value just go for it,positive
"Crompton 75 L Desert Air Cooler??????(White, Teal, ACGC-DAC751)",9999,5,brilliant,build is strong dimensions is good fan throw is very good goes to 20ft very easilywheels are strong can easily move even when cooler is full very good product at this price range,positive
"Crompton 75 L Desert Air Cooler??????(White, Teal, ACGC-DAC751)",9999,5,highly recommended,satisfied with this product super air flow amazing built quality height is good cooling is also good its not offering many features but i think its main function as a good cooler its work best for me i review this after 1 month of used,positive
"Crompton 75 L Desert Air Cooler??????(White, Teal, ACGC-DAC751)",9999,5,excellent,cooler is nice but have some drawbacks as well i will focus on only draw backs because whatever feature it claims it has them upto mark 1 it is useful only for one person2 it will work only when proper cross ventilation is available other wise would create unbearable humidity in the atmosphere of your room or house3 front flabs are loos ened after use and they can not guide the air properly so everytime you will have to guide them in your direction it will irritate you especially i,positive
"Crompton 75 L Desert Air Cooler??????(White, Teal, ACGC-DAC751)",9999,3,fair,i would certainly recommend symphony cooler in this range because earlier i hav experience with symphony and now i had purchased this 1 month agosymphony is superior to crompton1 less noise2 better air delivery,positive
"Crompton 75 L Desert Air Cooler??????(White, Teal, ACGC-DAC751)",9999,5,perfect product!,well i was confused between hindware and crompton but finally i went with this only as motor king is crompton only air flow is awesomelight weightcoolness is fantasticif you trust on brand you can blindly go with thiswin win situation thank you flipkart for awesome delevery experience as usual,positive
"Crompton 75 L Desert Air Cooler??????(White, Teal, ACGC-DAC751)",9999,5,best cooler !,crompton 75l desert cooler is the best coolerits cooling effect is very good even in moderate temperaturecooling remains for longer time not only when it is onand it cools large area for effective cooling not like tower or personal coolervery happy with purchase highly recommended for better and effective cooling,positive
"Crompton 75 L Desert Air Cooler??????(White, Teal, ACGC-DAC751)",9999,5,great product,excellent cooler work well only when window are open for ventilation provide decent cooling with water when ventilation is provided,positive
"Crompton 75 L Desert Air Cooler??????(White, Teal, ACGC-DAC751)",9999,4,wonderful,air cooler is working well giving heat relief from summer heat provided cross ventilation is good less noise its better to connect water hose to air cooler directly and due to water evaporation the 70ltr water doesnt last for the whole nightit has inbuilt wheels sturdy to move across the room highly recommend this product,positive
"Crompton 75 L Desert Air Cooler??????(White, Teal, ACGC-DAC751)",9999,5,perfect product!,excellent air cooler i am very happy and good sellers and good flipkart,positive
"Crompton 75 L Desert Air Cooler??????(White, Teal, ACGC-DAC751)",9999,4,value-for-money,good product on fully hot summer if you are living in place like humidity area it not helps to cool you,positive
"Crompton 75 L Desert Air Cooler??????(White, Teal, ACGC-DAC751)",9999,5,brilliant,working well and cooling is also greati liked this product and ill also get a great deal as compared to market price,positive
"Crompton 75 L Desert Air Cooler??????(White, Teal, ACGC-DAC751)",9999,5,super!excelleant product,delievered in just 24 hours after the order which is in good condition as it is well packed cooling was very good when compared to previous coolers worth the money paid for it good service too,positive
"Crompton 75 L Desert Air Cooler??????(White, Teal, ACGC-DAC751)",9999,5,fabulous!,fantastic air throw and yet quiet fan great cooling and cool design,positive
"Crompton 75 L Desert Air Cooler??????(White, Teal, ACGC-DAC751)",9999,5,brilliant,i ama truly satisfied with the product it cools the room very well even if the temperature is more than 42 degree celcius i live in a place where the temperature goes more than 40 degree in the mid summer i stay on the top floor but since i am using this cooler i am having no problem due to excessive temperature which i used to face before you just have to place the cooler in the right place with the right and scientific procedure,positive
"Crompton 75 L Desert Air Cooler??????(White, Teal, ACGC-DAC751)",9999,5,highly recommended,better plastic quality than symphony better price honey comb panelssleek suggest every symphony fan to give it a try as it is better in terms of product quality symphony quality has decreased a lot in few years,positive
"Crompton 75 L Desert Air Cooler??????(White, Teal, ACGC-DAC751)",9999,5,terrific,good product given same model which one i choose delivered safely i love flipkart services that i owe till now thanks flipkart team for wonderful job you are doing,positive
"Crompton 75 L Desert Air Cooler??????(White, Teal, ACGC-DAC751)",9999,5,awesome,in short it is better than snowcrest 85 which is one of the best air coolers out there crompton machines are less noisy and the air throw is wide and thats where snowcrest gets beaten but on the bright side the latter throws higher volumes of air i personally think that crompton is best for rooms whereas snowcrest from hindware is better suited for bigger halls,positive
"Crompton 75 L Desert Air Cooler??????(White, Teal, ACGC-DAC751)",9999,5,wonderful,the best in this price range with excellent air throw sufficient for a hall and adequate cooling adequate ventilation is needed to work properlyworks best when kept near a window and another window should be opened to push humidity outwater lasts for 1 to 2 daysthis cooler can make the difference in hot climate when it brings down the room temperature the new smell goes off in a week a good choice to combat summer heatps thanks flipkart for the brilliant delivery,positive
"Crompton 75 L Desert Air Cooler??????(White, Teal, ACGC-DAC751)",9999,3,nice,pros the best cooling out there with 75l liter capacity and plastic used is also really good cons plugg in cable length is not even half meter and huge noise which will not allow you to sleep so what is the point it is like giving you an ak47 without bullet you have a wonderful gun but you cannot use it for the purpose you got it for,positive
"Crompton 75 L Desert Air Cooler??????(White, Teal, ACGC-DAC751)",9999,4,very good,cooler recd in good condition from flipkart within delivery timequality of cooler is so wise as per expectationair circulation and flow is too good with honeycomb colling effectthanks to flipkart for providing valuable product,positive
"Crompton 75 L Desert Air Cooler??????(White, Teal, ACGC-DAC751)",9999,4,worth the money,good product works best when kept near a window and when outside temperature is low it cools like a mini ac overall nice product solves the purpose in places where temp raises to 35 to 38 degrees,positive
"Crompton 75 L Desert Air Cooler??????(White, Teal, ACGC-DAC751)",9999,5,mind-blowing purchase,very nice cool breeze liked it very much,positive
