product_name,product_price,Rate,Summary,Review,Sentiment
"Candes 12 L Room/Personal Air Cooler??????(White, Black, Elegant High Speed-Honey Comb Cooling Pad & Ice Chamber, Blower)",3999,5,super!,great cooler excellent air flow and for this price its so amazing and unbelievablejust love it,positive
"Candes 12 L Room/Personal Air Cooler??????(White, Black, Elegant High Speed-Honey Comb Cooling Pad & Ice Chamber, Blower)",3999,5,awesome,best budget 2 fit cooler nice cooling,positive
"Candes 12 L Room/Personal Air Cooler??????(White, Black, Elegant High Speed-Honey Comb Cooling Pad & Ice Chamber, Blower)",3999,3,fair,the quality is good but the power of air is decent,positive
"Candes 12 L Room/Personal Air Cooler??????(White, Black, Elegant High Speed-Honey Comb Cooling Pad & Ice Chamber, Blower)",3999,1,useless product,very bad product its a only a fan,negative
"Candes 12 L Room/Personal Air Cooler??????(White, Black, Elegant High Speed-Honey Comb Cooling Pad & Ice Chamber, Blower)",3999,3,fair,ok ok product,neutral
"Candes 12 L Room/Personal Air Cooler??????(White, Black, Elegant High Speed-Honey Comb Cooling Pad & Ice Chamber, Blower)",3999,5,awesome,the cooler is really fantastic and provides good air flow highly recommended,positive
"Candes 12 L Room/Personal Air Cooler??????(White, Black, Elegant High Speed-Honey Comb Cooling Pad & Ice Chamber, Blower)",3999,5,highly recommended,very good product,positive
"Candes 12 L Room/Personal Air Cooler??????(White, Black, Elegant High Speed-Honey Comb Cooling Pad & Ice Chamber, Blower)",3999,3,nice,very nice,positive
"Candes 12 L Room/Personal Air Cooler??????(White, Black, Elegant High Speed-Honey Comb Cooling Pad & Ice Chamber, Blower)",3999,1,unsatisfactory,very bad cooler,negative
"Candes 12 L Room/Personal Air Cooler??????(White, Black, Elegant High Speed-Honey Comb Cooling Pad & Ice Chamber, Blower)",3999,4,worth the money,very good,positive
"Candes 60 L Room/Personal Air Cooler??????(White, Black, CRETA)",8999,5,great product,beautiful product good material and perfectly working,positive
"Candes 60 L Room/Personal Air Cooler??????(White, Black, CRETA)",8999,5,mind-blowing purchase,awesome,positive
"Candes 60 L Room/Personal Air Cooler??????(White, Black, CRETA)",8999,5,highly recommended,good,positive
"Candes 60 L Room/Personal Air Cooler??????(White, Black, CRETA)",8999,5,brilliant,wonderful product must buy,positive
"Candes 60 L Room/Personal Air Cooler??????(White, Black, CRETA)",8999,5,classy product,nice air cooler smart cool breeze producer,positive
"Candes 60 L Room/Personal Air Cooler??????(White, Black, CRETA)",8999,5,must buy!,awsm,positive
"Candes 60 L Room/Personal Air Cooler??????(White, Black, CRETA)",8999,5,fabulous!,nice product,positive
"Candes 60 L Room/Personal Air Cooler??????(White, Black, CRETA)",8999,5,worth every penny,great cooler,positive
"Candes 60 L Room/Personal Air Cooler??????(White, Black, CRETA)",8999,5,super!,nice product,positive
"Candes 60 L Room/Personal Air Cooler??????(White, Black, CRETA)",8999,5,great product,good,positive
"Candes 60 L Room/Personal Air Cooler??????(White, Black, CRETA)",8999,5,awesome,very nice product,positive
"Candes 60 L Room/Personal Air Cooler??????(White, Black, CRETA)",8999,5,worth every penny,good product,positive
"Candes 60 L Room/Personal Air Cooler??????(White, Black, CRETA)",8999,5,just wow!,nice product with the reasonable price,positive
"Candes 60 L Room/Personal Air Cooler??????(White, Black, CRETA)",8999,5,awesome,i like it,positive
"Candes 60 L Room/Personal Air Cooler??????(White, Black, CRETA)",8999,5,terrific purchase,very goodd,positive
"Candes 60 L Room/Personal Air Cooler??????(White, Black, CRETA)",8999,5,excellent,good product,positive
"Candes 60 L Room/Personal Air Cooler??????(White, Black, CRETA)",8999,5,worth every penny,good product kawaleti,positive
"Candes 60 L Room/Personal Air Cooler??????(White, Black, CRETA)",8999,5,terrific,very good cooler amazing beautiful designs affordable price,positive
"Candes 60 L Room/Personal Air Cooler??????(White, Black, CRETA)",8999,5,awesome,using since 3months great experience,positive
"Candes 60 L Room/Personal Air Cooler??????(White, Black, CRETA)",8999,5,simply awesome,very good performance and nice look,positive
"Candes 60 L Room/Personal Air Cooler??????(White, Black, CRETA)",8999,4,wonderful,product is good having strong thrust of air flow must buy,positive
"Candes 60 L Room/Personal Air Cooler??????(White, Black, CRETA)",8999,5,terrific,very good,positive
"Candes 60 L Room/Personal Air Cooler??????(White, Black, CRETA)",8999,2,expected a better product,bad quality,negative
"Candes 60 L Room/Personal Air Cooler??????(White, Black, CRETA)",8999,5,excellent,very nice product,positive
"Candes 60 L Room/Personal Air Cooler??????(White, Black, CRETA)",8999,5,terrific purchase,very soundless product and low price other company,positive
"Candes 60 L Room/Personal Air Cooler??????(White, Black, CRETA)",8999,5,wonderful,nice,positive
"MAHARAJA WHITELINE 65 L Desert Air Cooler??????(White, Grey, Rambo Grey / AC-303)",7999,5,wonderful,the best poduct that i bought from flifkart it works superb like ac and price is also reasonable only rs 8698,positive
"MAHARAJA WHITELINE 65 L Desert Air Cooler??????(White, Grey, Rambo Grey / AC-303)",7999,4,good quality product,cooler is big and wide maharaja brand trust y every thing is good about cooler create less noise only thing is that its motor is not powerful even in high speed rest all things are good but yes for one middle size room it is ok,positive
"MAHARAJA WHITELINE 65 L Desert Air Cooler??????(White, Grey, Rambo Grey / AC-303)",7999,5,awesome,it is one of the best air coolers at reasonable price have ever seen but the ventilation of the room is must for proper cooling but the size is quite big it will i hope create a space problem during off seasons the air supply is very good and its one of the essential part of the air cooler with the wool wood pads which helps to make super cooling afterall thank you maharaja company to make such a product in affordable and reasonable price,positive
"MAHARAJA WHITELINE 65 L Desert Air Cooler??????(White, Grey, Rambo Grey / AC-303)",7999,5,excellent,awesome air cooleri was looking for a cooler under this range and this has fulfilled my requirement this has the following features1 great air through the capacity of 5000 m3hr 2 comes with a large 65litre tank which can run overnight with ease3 great built that is a shockproof and reliable material4 you have to stop this beast at night because it has that massive cooling capabilityone small concern is mine and it is for sure that it is not a dealbreaker that it produces s,positive
"MAHARAJA WHITELINE 65 L Desert Air Cooler??????(White, Grey, Rambo Grey / AC-303)",7999,5,great product,purchased after a lot of discussions and reviews i would say this the best which gives you the comfort needed best to for with no 2nd thoughts nice cooling low noise hope this should be energy efficient and used for a long run,positive
"MAHARAJA WHITELINE 65 L Desert Air Cooler??????(White, Grey, Rambo Grey / AC-303)",7999,5,highly recommended,very nice cooler cooling is very good there is no noise i reviewed a lot then only i purchased it if you want effective cooling you have to set it up at a window where there is cross ventilation without cross ventilation it will make environment humid lookwise it is very nice and material is strong,positive
"MAHARAJA WHITELINE 65 L Desert Air Cooler??????(White, Grey, Rambo Grey / AC-303)",7999,5,awesome,feedback given after using one week the cooler is amazing its making the whole room cooling you should install the cooler near to your windows the delivery was on time as well the delivery boy also very supportive,positive
"MAHARAJA WHITELINE 65 L Desert Air Cooler??????(White, Grey, Rambo Grey / AC-303)",7999,3,decent product,great deal 65 l quite big tank sufficient cooling for one medium size room 3 modes works well best in this range,positive
"MAHARAJA WHITELINE 65 L Desert Air Cooler??????(White, Grey, Rambo Grey / AC-303)",7999,5,fabulous!,i bought this cooler on heavy discount by flipkart cooler is build of good quality material it has a fast fan with powerfull motor pump air quality is excellent even for a big room a must buy value for money product,positive
"MAHARAJA WHITELINE 65 L Desert Air Cooler??????(White, Grey, Rambo Grey / AC-303)",7999,3,very satisfactory,the good things1 very well packed good amount of thermocols to protect from transport damages2 sturdy body3 relatively less noise as compared to bajaj cooler i had earlierwish this was betterfor many purposes it is necessary to open cooler body opening the body of cooler is not very intuitive common consumers may not even attempt for fear of damaging something 1 easy opening of side frames to change pads or clean the water inlets2 water balloon used to cut water supply au,positive
"MAHARAJA WHITELINE 65 L Desert Air Cooler??????(White, Grey, Rambo Grey / AC-303)",7999,4,good quality product,excellent producthappy with resultnice air flowosm cooling,positive
"MAHARAJA WHITELINE 65 L Desert Air Cooler??????(White, Grey, Rambo Grey / AC-303)",7999,5,mind-blowing purchase,cooler works fine and it is inverter friendly,positive
"MAHARAJA WHITELINE 65 L Desert Air Cooler??????(White, Grey, Rambo Grey / AC-303)",7999,1,waste of money!,small wire and moter capacity is very low fan speed was not good out flow vent hole is above the lower part of cooler its very difficult to change water,negative
"MAHARAJA WHITELINE 65 L Desert Air Cooler??????(White, Grey, Rambo Grey / AC-303)",7999,5,must buy!,perfect product for large size room,positive
"MAHARAJA WHITELINE 65 L Desert Air Cooler??????(White, Grey, Rambo Grey / AC-303)",7999,4,good not best,average cooling not much as expected by size and reviews of cooler cooling is sufficient maharaja whiteline should work on its cooling efficiency and reduce size by width can increase in height to maintain tank capacity,positive
"MAHARAJA WHITELINE 65 L Desert Air Cooler??????(White, Grey, Rambo Grey / AC-303)",7999,5,must buy!,product was amazing cooling capacity awsum pls go for ahead a big thumbs up,positive
"MAHARAJA WHITELINE 65 L Desert Air Cooler??????(White, Grey, Rambo Grey / AC-303)",7999,4,does the job,good,positive
"MAHARAJA WHITELINE 65 L Desert Air Cooler??????(White, Grey, Rambo Grey / AC-303)",7999,3,nice,received dalay 10 days cooler is ok when i was reveived switch damaged,negative
"MAHARAJA WHITELINE 65 L Desert Air Cooler??????(White, Grey, Rambo Grey / AC-303)",7999,4,worth the money,big oneworking good 2days of use hope will work for long run,positive
"MAHARAJA WHITELINE 65 L Desert Air Cooler??????(White, Grey, Rambo Grey / AC-303)",7999,4,pretty good,good product nice air flow and no noice,positive
"MAHARAJA WHITELINE 65 L Desert Air Cooler??????(White, Grey, Rambo Grey / AC-303)",7999,5,good cooler,in this price good cooler,positive
"MAHARAJA WHITELINE 65 L Desert Air Cooler??????(White, Grey, Rambo Grey / AC-303)",7999,4,wonderful,is good for many,positive
"MAHARAJA WHITELINE 65 L Desert Air Cooler??????(White, Grey, Rambo Grey / AC-303)",7999,4,wonderful,it is an awesome product light weight easy to use and having lot of features,positive
"MAHARAJA WHITELINE 65 L Desert Air Cooler??????(White, Grey, Rambo Grey / AC-303)",7999,1,worthless,the product doesnt cool as rated by other customers the cooling is very slow very wrost product i recommend to not buy this item wastage of money,positive
"MAHARAJA WHITELINE 65 L Desert Air Cooler??????(White, Grey, Rambo Grey / AC-303)",7999,5,great product,looks like monster cooler it is working as awesome,positive
"MAHARAJA WHITELINE 65 L Desert Air Cooler??????(White, Grey, Rambo Grey / AC-303)",7999,5,great product,very nice product thank you flipkart,positive
"MAHARAJA WHITELINE 65 L Desert Air Cooler??????(White, Grey, Rambo Grey / AC-303)",7999,5,must buy!,very good,positive
"MAHARAJA WHITELINE 65 L Desert Air Cooler??????(White, Grey, Rambo Grey / AC-303)",7999,4,good quality product,good cooler it occupies more space looks very large but good for hall it covers all the places,positive
"MAHARAJA WHITELINE 65 L Desert Air Cooler??????(White, Grey, Rambo Grey / AC-303)",7999,3,decent product,very impressive coolerpros stylish energy efficient 165 watt very good air throw and cooling summersible pumpcons very bulky take more place than other no wheel lack of ice box,positive
"MAHARAJA WHITELINE 65 L Desert Air Cooler??????(White, Grey, Rambo Grey / AC-303)",7999,5,brilliant,best cooler i bought 6884,positive
"MAHARAJA WHITELINE 65 L Desert Air Cooler??????(White, Grey, Rambo Grey / AC-303)",7999,5,super!,excellent cooler in this price rangepros1 air throw is very powerful even when u run it at slow speed setting 2 cooling and tank capacity3 ergonomics cons1 if you want to clean the cooler then opening the pads is very cumbersome process if you have placed it on some flat surface then also draining the old water is very difficult overall v good cooler apart from above cons and considering price,positive
"MAHARAJA WHITELINE 65 L Desert Air Cooler??????(White, Grey, Rambo Grey / AC-303)",7999,1,worst experience ever!,cooler not provide cool air because 1year experience,negative
"MAHARAJA WHITELINE 65 L Desert Air Cooler??????(White, Grey, Rambo Grey / AC-303)",7999,5,perfect product!,a good product in budget,positive
"MAHARAJA WHITELINE 65 L Desert Air Cooler??????(White, Grey, Rambo Grey / AC-303)",7999,4,wonderful,packaging excellent value for money product,positive
"MAHARAJA WHITELINE 65 L Desert Air Cooler??????(White, Grey, Rambo Grey / AC-303)",7999,5,simply awesome,delivered within 2 days working good,positive
"MAHARAJA WHITELINE 65 L Desert Air Cooler??????(White, Grey, Rambo Grey / AC-303)",7999,4,nice product,efficient for large roomspros1 low noise of fan2 inverter friendly3 cools large rooms fastly and easily4 it have aroma chamber in which you can add tablet of frangrance to counter smell of woodwool pads5 it have 2 section for air flow which means you can adjust it to get air for double decker cot equallycons1they should have provided stand of castor wheel for it to move2 it should have ice chamberwill update more about it in future,positive
"MAHARAJA WHITELINE 65 L Desert Air Cooler??????(White, Grey, Rambo Grey / AC-303)",7999,4,worth the money,better than the steel cooler less noise and value for money,positive
"MAHARAJA WHITELINE 65 L Desert Air Cooler??????(White, Grey, Rambo Grey / AC-303)",7999,1,useless product,dont buy maharaja whiteline coolers they have cheap aluminum motors that are good for at max 2 years repair cost of these motors is so high that u would want to sell rather than repair them,positive
"MAHARAJA WHITELINE 65 L Desert Air Cooler??????(White, Grey, Rambo Grey / AC-303)",7999,5,excellent,very nice product and delivery is satisfied,positive
"MAHARAJA WHITELINE 65 L Desert Air Cooler??????(White, Grey, Rambo Grey / AC-303)",7999,1,"like an assembled, one can get for 4.5k cheap quality",no quality product1 the wood wool has started falling out from the next day2 out of two led indicator has found not working on arrival3 the air swinger is already giving noise when moving which never used to be in my old cooler which i am using since 3 years4 the quality is no way machine to branded coolers5 anti bacterial tank has been bacterial now as there is no way to clean it so congested to maintain it cleanlyin my way think before you buyac has option to aut,negative
"MAHARAJA WHITELINE 65 L Desert Air Cooler??????(White, Grey, Rambo Grey / AC-303)",7999,5,simply awesome,air throw is very good it makes room very cool in just half an hour full tank capacity is 65 litres which stays up to 5 hours it makes big living room colder not very much noisy,positive
"MAHARAJA WHITELINE 65 L Desert Air Cooler??????(White, Grey, Rambo Grey / AC-303)",7999,5,great product,on time delivery received exact productthank u flipkart,positive
"MAHARAJA WHITELINE 65 L Desert Air Cooler??????(White, Grey, Rambo Grey / AC-303)",7999,5,wonderful,maharaja always no 1,positive
"MAHARAJA WHITELINE 65 L Desert Air Cooler??????(White, Grey, Rambo Grey / AC-303)",7999,5,wonderful,awesome product love this,positive
"MAHARAJA WHITELINE 65 L Desert Air Cooler??????(White, Grey, Rambo Grey / AC-303)",7999,2,not good,poar quality plastic material is not good,negative
"MAHARAJA WHITELINE 65 L Desert Air Cooler??????(White, Grey, Rambo Grey / AC-303)",7999,4,very good,value for money,positive
"MAHARAJA WHITELINE 65 L Desert Air Cooler??????(White, Grey, Rambo Grey / AC-303)",7999,5,super!,nice cooler,positive
"MAHARAJA WHITELINE 65 L Desert Air Cooler??????(White, Grey, Rambo Grey / AC-303)",7999,5,terrific purchase,fantastic product great cool,positive
"MAHARAJA WHITELINE 65 L Desert Air Cooler??????(White, Grey, Rambo Grey / AC-303)",7999,2,slightly disappointed,dont buy just by seing the comments dont know how people review and rate the product cooling is ok but when it comes to fill the water you would need inlet pipe to fill the water we cannot open from the backsides to fill the watercleaning is highly impossible because there is no way you can open and clean worst design other small small branded companies provide all those facilities but this is worst product design totally unhappy with this product,negative
"MAHARAJA WHITELINE 65 L Desert Air Cooler??????(White, Grey, Rambo Grey / AC-303)",7999,4,good quality product,best at its price,positive
"MAHARAJA WHITELINE 65 L Desert Air Cooler??????(White, Grey, Rambo Grey / AC-303)",7999,2,expected a better product,this is my review after using this product for a week1air throw is good2produce less noise3good product at reasonable pricebut it never open from behindnot easy to cleanrefill the watercable is short,positive
"MAHARAJA WHITELINE 65 L Desert Air Cooler??????(White, Grey, Rambo Grey / AC-303)",7999,1,horrible,cooling fan problem,negative
"MAHARAJA WHITELINE 65 L Desert Air Cooler??????(White, Grey, Rambo Grey / AC-303)",7999,3,nice,after discount rs 7200 price is okquality is okdelivery as on time okmotor speed 1200 rpm okpump okcolour is ok look is also okwater storage is appx 65 ltd more than 3 large bucket is okstill giving 3 star because it is a large in size and in width not fit to my window not expectedwill give next rating after couple of month usagethanx flipkart,positive
"MAHARAJA WHITELINE 65 L Desert Air Cooler??????(White, Grey, Rambo Grey / AC-303)",7999,4,good quality product,product is really worthy of price 8k however it occupied more space in room should one consider it before buy it worth for that money,positive
"MAHARAJA WHITELINE 65 L Desert Air Cooler??????(White, Grey, Rambo Grey / AC-303)",7999,5,simply awesome,mind blowing very good for hall and for big wondow its really big in size quality is nice must buy,positive
"MAHARAJA WHITELINE 65 L Desert Air Cooler??????(White, Grey, Rambo Grey / AC-303)",7999,5,mind-blowing purchase,good and sufficient size,positive
"MAHARAJA WHITELINE 65 L Desert Air Cooler??????(White, Grey, Rambo Grey / AC-303)",7999,5,highly recommended,awesome,positive
"MAHARAJA WHITELINE 65 L Desert Air Cooler??????(White, Grey, Rambo Grey / AC-303)",7999,5,fabulous!,good product,positive
"MAHARAJA WHITELINE 65 L Desert Air Cooler??????(White, Grey, Rambo Grey / AC-303)",7999,5,brilliant,best product,positive
"MAHARAJA WHITELINE 65 L Desert Air Cooler??????(White, Grey, Rambo Grey / AC-303)",7999,5,great product,very good,positive
"MAHARAJA WHITELINE 65 L Desert Air Cooler??????(White, Grey, Rambo Grey / AC-303)",7999,5,highly recommended,good product delivery on time,positive
"MAHARAJA WHITELINE 65 L Desert Air Cooler??????(White, Grey, Rambo Grey / AC-303)",7999,5,must buy!,nice product deliver in time,positive
"MAHARAJA WHITELINE 65 L Desert Air Cooler??????(White, Grey, Rambo Grey / AC-303)",7999,5,terrific purchase,i honestly liked the productbest desert cooler at lowest price i got the deal of 6889nice brand good built quality with precision to eachgood switches and knobs to controltakes space as its hugevery silentnot high but good speed fan to cool upto upto 12 feetno ice tray but its not a mattergo for it,positive
"MAHARAJA WHITELINE 65 L Desert Air Cooler??????(White, Grey, Rambo Grey / AC-303)",7999,1,very poor,dont buy this product within 15 year wind blade was broken and noise issue wind blow very low its better to go other brand,negative
"MAHARAJA WHITELINE 65 L Desert Air Cooler??????(White, Grey, Rambo Grey / AC-303)",7999,5,mind-blowing purchase,awesome product,positive
"MAHARAJA WHITELINE 65 L Desert Air Cooler??????(White, Grey, Rambo Grey / AC-303)",7999,5,terrific purchase,very good product,positive
"MAHARAJA WHITELINE 65 L Desert Air Cooler??????(White, Grey, Rambo Grey / AC-303)",7999,4,good quality product,valu for money,positive
"MAHARAJA WHITELINE 65 L Desert Air Cooler??????(White, Grey, Rambo Grey / AC-303)",7999,4,wonderful,nice to,positive
"MAHARAJA WHITELINE 65 L Desert Air Cooler??????(White, Grey, Rambo Grey / AC-303)",7999,1,useless product,worst product fan speed very slowlike nothing,negative
"MAHARAJA WHITELINE 65 L Desert Air Cooler??????(White, Grey, Rambo Grey / AC-303)",7999,5,terrific purchase,best product,positive
"MAHARAJA WHITELINE 65 L Desert Air Cooler??????(White, Grey, Rambo Grey / AC-303)",7999,5,simply awesome,big size mostly like industrial cooler but within this price and my house is big it is perfect no wheels but can buy stand and it works fine if you have close home and less space go for other options,positive
"MAHARAJA WHITELINE 65 L Desert Air Cooler??????(White, Grey, Rambo Grey / AC-303)",7999,1,unsatisfactory,very bad service by flipkart customer care representative and jeeves agent too much bad performance no cooling just like a stand fan,negative
"MAHARAJA WHITELINE 65 L Desert Air Cooler??????(White, Grey, Rambo Grey / AC-303)",7999,4,really nice,oh really really very good i am so happy,positive
"MAHARAJA WHITELINE 65 L Desert Air Cooler??????(White, Grey, Rambo Grey / AC-303)",7999,1,unsatisfactory,low air and not cooling as axcpected,negative
"MAHARAJA WHITELINE 65 L Desert Air Cooler??????(White, Grey, Rambo Grey / AC-303)",7999,5,best in the market!,super cooling system,positive
"MAHARAJA WHITELINE 65 L Desert Air Cooler??????(White, Grey, Rambo Grey / AC-303)",7999,5,highly recommended,very nice working,positive
"MAHARAJA WHITELINE 65 L Desert Air Cooler??????(White, Grey, Rambo Grey / AC-303)",7999,5,classy product,excellent performance,positive
"MAHARAJA WHITELINE 65 L Desert Air Cooler??????(White, Grey, Rambo Grey / AC-303)",7999,4,good quality product,good,positive
"MAHARAJA WHITELINE 65 L Desert Air Cooler??????(White, Grey, Rambo Grey / AC-303)",7999,5,best in the market!,wonderful product can go for it,positive
"MAHARAJA WHITELINE 65 L Desert Air Cooler??????(White, Grey, Rambo Grey / AC-303)",7999,4,good quality product,really desert cooler super cool,positive
"MAHARAJA WHITELINE 65 L Desert Air Cooler??????(White, Grey, Rambo Grey / AC-303)",7999,5,brilliant,very good product water flow must be slow from pump but its okay,positive
"MAHARAJA WHITELINE 65 L Desert Air Cooler??????(White, Grey, Rambo Grey / AC-303)",7999,1,absolute rubbish!,water inlet is not good,negative
"MAHARAJA WHITELINE 65 L Desert Air Cooler??????(White, Grey, Rambo Grey / AC-303)",7999,5,terrific,awesome,positive
"MAHARAJA WHITELINE 65 L Desert Air Cooler??????(White, Grey, Rambo Grey / AC-303)",7999,5,terrific purchase,owsum product,positive
"MAHARAJA WHITELINE 65 L Desert Air Cooler??????(White, Grey, Rambo Grey / AC-303)",7999,3,just okay,not so good,negative
"MAHARAJA WHITELINE 65 L Desert Air Cooler??????(White, Grey, Rambo Grey / AC-303)",7999,4,nice product,cooler is really very good but use any cooler ventilation os a must without ventilation no cooler will work especially in rainy seasonproduct is original was delivered safely this review is after a week,positive
"MAHARAJA WHITELINE 65 L Desert Air Cooler??????(White, Grey, Rambo Grey / AC-303)",7999,4,good quality product,ice product,positive
"MAHARAJA WHITELINE 65 L Desert Air Cooler??????(White, Grey, Rambo Grey / AC-303)",7999,5,perfect product!,not working motors and very bad poor maharaja cooler,negative
"MAHARAJA WHITELINE 65 L Desert Air Cooler??????(White, Grey, Rambo Grey / AC-303)",7999,5,must buy!,very good product worth buying,positive
"MAHARAJA WHITELINE 65 L Desert Air Cooler??????(White, Grey, Rambo Grey / AC-303)",7999,5,perfect product!,good product,positive
"MAHARAJA WHITELINE 65 L Desert Air Cooler??????(White, Grey, Rambo Grey / AC-303)",7999,2,bad quality,fan speed is slow and making lot of noise,positive
"MAHARAJA WHITELINE 65 L Desert Air Cooler??????(White, Grey, Rambo Grey / AC-303)",7999,5,mind-blowing purchase,nice cooler perfect for hall,positive
"MAHARAJA WHITELINE 65 L Desert Air Cooler??????(White, Grey, Rambo Grey / AC-303)",7999,4,worth the money,very good cooling,positive
"MAHARAJA WHITELINE 65 L Desert Air Cooler??????(White, Grey, Rambo Grey / AC-303)",7999,1,worst experience ever!,average production,neutral
"MAHARAJA WHITELINE 65 L Desert Air Cooler??????(White, Grey, Rambo Grey / AC-303)",7999,4,really nice,awesome,positive
"MAHARAJA WHITELINE 65 L Desert Air Cooler??????(White, Grey, Rambo Grey / AC-303)",7999,5,fabulous!,awesome,positive
"MAHARAJA WHITELINE 65 L Desert Air Cooler??????(White, Grey, Rambo Grey / AC-303)",7999,5,highly recommended,nice product,positive
"MAHARAJA WHITELINE 65 L Desert Air Cooler??????(White, Grey, Rambo Grey / AC-303)",7999,5,fabulous!,good aircoolr,positive
"MAHARAJA WHITELINE 65 L Desert Air Cooler??????(White, Grey, Rambo Grey / AC-303)",7999,4,good quality product,nice,positive
