product_name,product_price,Rate,Summary,Review,Sentiment
"boAt Rockerz 510 Super Extra Bass Bluetooth Headset??????(Molten Orange, On the Ear)",1199,4,really nice,bought during the big billion day pros1 sound quality is very good bass is optimal2 buttons are well built and works fine while controlling music or calls3 the ear cushions are soft and comfortable4 battery backup is also goodcons1 the headphones feel a bit too tight around the ears i think in due course it will expand and get adjusted but in a first usage its feel a bit tight2 while talking during calls one needs to speak loudly to get picked up by the mic i t,positive
"boAt Rockerz 510 Super Extra Bass Bluetooth Headset??????(Molten Orange, On the Ear)",1199,5,just wow!,very lovable headphones it is soun is superb bass is good and the price was also awesome i got it in 1275 in diwali sale,positive
"boAt Rockerz 510 Super Extra Bass Bluetooth Headset??????(Molten Orange, On the Ear)",1199,5,super!,the product is flawless that is lovely satisfied to mecongrats to boat rockerz 510 the sound quality is so good and bass is too good thank you boat,positive
"boAt Rockerz 510 Super Extra Bass Bluetooth Headset??????(Molten Orange, On the Ear)",1199,4,really nice,sound quality is goodbut in high volume music is clearly audible to others which is very bad and cannot be ignoredbattery backup is fairly goodbuilt is above averageconnectivity is awesomemic is clear during call,positive
"boAt Rockerz 510 Super Extra Bass Bluetooth Headset??????(Molten Orange, On the Ear)",1199,4,delightful,this product is way better than i thought the designs are cool and connectivity is also good and crystal clear sound etc this product is better than i expected,positive
"boAt Rockerz 510 Super Extra Bass Bluetooth Headset??????(Molten Orange, On the Ear)",1199,5,worth every penny,good quality as expected but at the price i purchsed1299 bluetooth wireless range actually working 10 m i would give 1010 for sound and bass it does sound clear at max volume and woofer vibrates on ear just amazing performance grt 50mm driver best,positive
"boAt Rockerz 510 Super Extra Bass Bluetooth Headset??????(Molten Orange, On the Ear)",1199,4,wonderful,it is a good product for bass loving persons it has very good sound quality i bought it for 1299 rs during big billion days it is perfect in this budget,positive
"boAt Rockerz 510 Super Extra Bass Bluetooth Headset??????(Molten Orange, On the Ear)",1199,5,just wow!,best bass best sound quality but body quality is not very good overall good product,neutral
"boAt Rockerz 510 Super Extra Bass Bluetooth Headset??????(Molten Orange, On the Ear)",1199,4,worth the money,its kind a good and light weight battery back up sound is super super good if u looking for best headphones and low budget u shud go for it,positive
"boAt Rockerz 510 Super Extra Bass Bluetooth Headset??????(Molten Orange, On the Ear)",1199,4,good quality product,sound quality awesome and best quality above average and design better and battery backup is also good i really like this headphone,positive
"boAt Rockerz 510 Super Extra Bass Bluetooth Headset??????(Molten Orange, On the Ear)",1199,5,excellent,really worth for money the bass effect is awesome and the battery back up is also fine if you looking to buy this dont have second thought just go it immediately,positive
"boAt Rockerz 510 Super Extra Bass Bluetooth Headset??????(Molten Orange, On the Ear)",1199,4,value-for-money,great sound quality good noise cancellationhigh bass especially in max volume i cant listen to it in max volume for too long low sound leakage only problem is that it is not comfortable i can listen 2230 hour max maybe because i had a on the headphone thats why this one is a little uncomfortable for me i recommend you to buy it if you do not intend to wear it 45 hrs in one sit otherwise try rockerz 600on the ear they are really comfortable for me battery backup for both headph,negative
"boAt Rockerz 510 Super Extra Bass Bluetooth Headset??????(Molten Orange, On the Ear)",1199,5,perfect product!,better than i expected nice product it also contains the aux cable which is also very good again a good product by flipkart,positive
"boAt Rockerz 510 Super Extra Bass Bluetooth Headset??????(Molten Orange, On the Ear)",1199,5,terrific,thorough bluetooth connectivity the audio play quality is awesome but through earphone its just like any other basic headphonesbut overall build quality is awesome sound is very good through bluetooth and via aux its just little better than regular,positive
"boAt Rockerz 510 Super Extra Bass Bluetooth Headset??????(Molten Orange, On the Ear)",1199,5,just wow!,bass is so awesome that there is nothing much to say just go for itsounds are also very clear it makes u feel like u are really in to itbattery is also good and there is the design which u can see from just design u will probably think its cost would be like 7k or 10k caz design is,positive
"boAt Rockerz 510 Super Extra Bass Bluetooth Headset??????(Molten Orange, On the Ear)",1199,5,must buy!,best headphones to buy under 2000 best voice quality and a powerful bass system which is very much enjoying while listening songs best headphones to buy,positive
"boAt Rockerz 510 Super Extra Bass Bluetooth Headset??????(Molten Orange, On the Ear)",1199,5,terrific,super battry backup i got this on 6 august and still i dont have charged it and i had used it lots of time and battry is still 50 sound quality is good bass is good for bass lover but not for someone who like super bass i got it for 1600 also it drop to price of 1300 in big billion day so wait for the sale best for this price range updated review after one year stil working very good even with very harsh care of this very durable believe me i have used so much very goog battry backup s,positive
"boAt Rockerz 510 Super Extra Bass Bluetooth Headset??????(Molten Orange, On the Ear)",1199,4,really nice,writing this after 6 months of use it is still good as it camei still get 78 hours of battery backup in this range this is the best boat has to offer i thinkone of my lovely feature is dual compatibility with bluetooth and 35mm jacksound and bass quality no complaints,positive
"boAt Rockerz 510 Super Extra Bass Bluetooth Headset??????(Molten Orange, On the Ear)",1199,4,pretty good,its so better with wire connection compare with bluetooth really with aux connection really awesome treble and bass are so good in that its definitely worthy no doubt at all,positive
"boAt Rockerz 510 Super Extra Bass Bluetooth Headset??????(Molten Orange, On the Ear)",1199,5,perfect product!,it is one of the best headphone i ever used superb sound quality have it if you have dream of listening good music the best part of this headphone is that it do not give headache even if u listen for hours in full volume loved it,positive
"boAt Rockerz 510 Super Extra Bass Bluetooth Headset??????(Molten Orange, On the Ear)",1199,5,terrific purchase,first of all the sound quality bestest the bass quality bestest design build childish or gamer type but better battery backup upto 10 hrs isnt it sufficient and last but not least comfortability bro first use it 23 days and it get comfortable very fast and in this range it is an best product worth buying it review boat rockerz 510 499 001 for such childish design but although it is great headphone,positive
"boAt Rockerz 510 Super Extra Bass Bluetooth Headset??????(Molten Orange, On the Ear)",1199,5,super!,awesome headphone at this price i bought it for 1299 and it really worth the money looks like big but light weight with smooth cushions,positive
"boAt Rockerz 510 Super Extra Bass Bluetooth Headset??????(Molten Orange, On the Ear)",1199,5,mind-blowing purchase,the product is good but the delivery was not good so far concerned boat has really worked hard on bass and the build quality is also good a good headphone in a suitable budget,positive
"boAt Rockerz 510 Super Extra Bass Bluetooth Headset??????(Molten Orange, On the Ear)",1199,5,highly recommended,amazing product just loving itbass is super greatsound quality is awesomedesign and build is dashing totally loving this headphonesamazing product from boat everyone should try these headphones,positive
"boAt Rockerz 510 Super Extra Bass Bluetooth Headset??????(Molten Orange, On the Ear)",1199,5,just wow!,dis is a very good and very different product to other i like it dis is best bluetooth headphone in under 2000 and is fabulous,positive
"boAt Rockerz 510 Super Extra Bass Bluetooth Headset??????(Molten Orange, On the Ear)",1199,5,must buy!,blindly purchase this product this is fully loaded with features it is very reliable for use he looks bold but whenever i used he feel like premium and lightweight most of all the sound clarity is superb,positive
"boAt Rockerz 510 Super Extra Bass Bluetooth Headset??????(Molten Orange, On the Ear)",1199,5,classy product,mind blowing purchase very easy to use great sound bass is good and battery backup is good overall package is excellent,positive
"boAt Rockerz 510 Super Extra Bass Bluetooth Headset??????(Molten Orange, On the Ear)",1199,5,simply awesome,this is one of the best headphones in thisprice range dont even think once just get this foryourself im totally impressed with boat ive bought around 4 products and all are truly amazing thank you boat,positive
"boAt Rockerz 510 Super Extra Bass Bluetooth Headset??????(Molten Orange, On the Ear)",1199,4,delightful,nice sound quality for music and gaming,positive
"boAt Rockerz 510 Super Extra Bass Bluetooth Headset??????(Molten Orange, On the Ear)",1199,4,wonderful,its a super bass headphonei strongly recommend this to everyone whos seeking for low budget headphonesbut only demerit is after using for several hours i feels some sort of earpain which is because of small earcups i thinkits the only problembut coming to sound quality and battery backup its the best low budget headphone,positive
"boAt Rockerz 510 Super Extra Bass Bluetooth Headset??????(Molten Orange, On the Ear)",1199,4,delightful,a good product for price good thumping bass surround sound effect makes you feel comfortable and enjoy music even at high volumes keeping the noise to the minimum an excellent product for that price totally worth the purchase,positive
"boAt Rockerz 510 Super Extra Bass Bluetooth Headset??????(Molten Orange, On the Ear)",1199,4,good choice,i like the design very much great look quality of sound is very sharp its excellentbass is too goodvery much satisfied with this purchase highly recommend for music lover,positive
"boAt Rockerz 510 Super Extra Bass Bluetooth Headset??????(Molten Orange, On the Ear)",1199,4,pretty good,its wonderful but its very big i mean if you would carry you should have bag with you but its good if are at home at night you can enjoy your music and its hard too for your ear but as per sound quality nd battery backup its fantastic,positive
"boAt Rockerz 510 Super Extra Bass Bluetooth Headset??????(Molten Orange, On the Ear)",1199,5,must buy!,though its very good and a awesome product but sometimes it feels like it disturbs the originality of the sound its best for listening bass boosted songs,positive
"boAt Rockerz 510 Super Extra Bass Bluetooth Headset??????(Molten Orange, On the Ear)",1199,5,perfect product!,wow i dint expect it is such a good product until i experience its really amazing headphone and definitely value for the money if you are planning to buy this then dont even think for a second thought just go blindly,positive
"boAt Rockerz 510 Super Extra Bass Bluetooth Headset??????(Molten Orange, On the Ear)",1199,5,highly recommended,best headphone i have ever used killer bass good sound quality and connectivity best for playing pubg just loved it one more amazing thing is its battery backup just believe me i am using it since 5 days daily at average of 56 hours and till now its 60 percent charged,positive
"boAt Rockerz 510 Super Extra Bass Bluetooth Headset??????(Molten Orange, On the Ear)",1199,5,perfect product!,wow its really a great headset and bass and 8d sounds are very amazing in this boat rockerz 510 and who wants gaming headset and good bass headset for music so go for it and who wants gaming headset for pubg and call of duty so this headset was greatly working for gaming really its a great product by boat i love it alot and thanks alot to flipkart for good delivery and thanks to boat for great product with fairy price,positive
"boAt Rockerz 510 Super Extra Bass Bluetooth Headset??????(Molten Orange, On the Ear)",1199,5,fabulous!,this headphones was a good sound quality and the bass was high level and is design is nice because the colour finesh is so good like glossary finesh,positive
"boAt Rockerz 510 Super Extra Bass Bluetooth Headset??????(Molten Orange, On the Ear)",1199,3,good,finally a good bluetooth headphone with mic which i was looking for call handling is easy call clarity is good receiving end appreciated the voice quality now about music guys take some time to setup your music players graphic equalizer for this headphone and youll be satisfied with its sound quality,positive
"boAt Rockerz 510 Super Extra Bass Bluetooth Headset??????(Molten Orange, On the Ear)",1199,5,brilliant,simply just wow amazing headphone flipkart speed delivery an good product thankq flipkart i love it,positive
"boAt Rockerz 510 Super Extra Bass Bluetooth Headset??????(Molten Orange, On the Ear)",1199,5,mind-blowing purchase,awesome sound but little bit heavy robust construction perfect fit nothing can be found like this at such price i got it for only 1169 during bbd sale,positive
"boAt Rockerz 510 Super Extra Bass Bluetooth Headset??????(Molten Orange, On the Ear)",1199,5,great product,super product super bass awesome boat its like wearing woofers on my ears,positive
"boAt Rockerz 510 Super Extra Bass Bluetooth Headset??????(Molten Orange, On the Ear)",1199,5,fabulous!,this is my honest review i purchased this before 15 days i used daily 5 hours but i charged the beast only 3 times the battery backup is like a himalaya but little bit pain in ears when i hearing sound in it i feel i was in movie theatre the android devices doesnt shows the battery percentage but ios showing the battery percentage i can connect over 4 devices at the same time finally the one word is i love it,positive
"boAt Rockerz 510 Super Extra Bass Bluetooth Headset??????(Molten Orange, On the Ear)",1199,5,fabulous!,i have purchase this product at rs 1170 during bbd i must say that headphone has superb built quality sound is clear with decent bass i would say that it is a good product in its segment headphones,positive
"boAt Rockerz 510 Super Extra Bass Bluetooth Headset??????(Molten Orange, On the Ear)",1199,5,mind-blowing purchase,this headphone is very fabulous there bass very strong this headphone sound is clear and there price is proper the quality of headphone is best buy this headphone there is no mistake it will give fast delivery there is no delay of product,positive
"boAt Rockerz 510 Super Extra Bass Bluetooth Headset??????(Molten Orange, On the Ear)",1199,3,nice,a great traveling companion battery life is yet to be juiced out but seems good as of now played 6 hours at 70 battery not for the audiophile bass is satisfactory person sitting beside can clearly listen to what you are playing built quality is good with tactile button response looks are sure stylish all in all a good wireless headphone from boat trivia billionaire sachin bansal has invested rs20 crore in boat,positive
"boAt Rockerz 510 Super Extra Bass Bluetooth Headset??????(Molten Orange, On the Ear)",1199,5,must buy!,value for money1 bass is better2 vocals are clear 3 comfort level is not good it started causing pain to my ears after 30min of usage 4 after all best under 1500 final verdict best buy under 1500 but remember it is not must buy,positive
"boAt Rockerz 510 Super Extra Bass Bluetooth Headset??????(Molten Orange, On the Ear)",1199,5,brilliant,very high rated product in this price range very well sound quality bass is not that super extra as per tagline comfortable spectacular design the bad side is it is non foldable,neutral
"boAt Rockerz 510 Super Extra Bass Bluetooth Headset??????(Molten Orange, On the Ear)",1199,5,terrific,nice superb sufficient and enough to take highin good time,positive
"boAt Rockerz 510 Super Extra Bass Bluetooth Headset??????(Molten Orange, On the Ear)",1199,4,good quality product,size is very huge bass is very good but echo is also very much so there is no perfect sound engineering but yes you be on call by putting this headphone it has nice connectivity of bluetooth as well,positive
"boAt Rockerz 510 Super Extra Bass Bluetooth Headset??????(Molten Orange, On the Ear)",1199,5,brilliant,best headphone in this range design is very attractive battery is awesome atleast 10 hrsi am using this from atleast 2 months and now also it looks like new i recommend you to buy it very loud voice with extra bass when you play a song in it you fells that you are standing in front of many big speakers,positive
"boAt Rockerz 510 Super Extra Bass Bluetooth Headset??????(Molten Orange, On the Ear)",1199,4,good quality product,really good output from these headphones 1totally covers ears2comfortable 3design is lit4best part about it is i literally felt vibration near my ears while playing games and watching movies like hole music system is near me its kinda dope5on the other side its bulky and people near seating around me can actually heard headphones voice while listening at hight volume but it doesnt matter a lot i guess 6overall best headphone till date you can give a try its worth it,positive
"boAt Rockerz 510 Super Extra Bass Bluetooth Headset??????(Molten Orange, On the Ear)",1199,4,nice product,its been a year im using it i like the way it works but the battery indicator didnt working my mobile its gets tuns off even the indicator shows 50 is halffull be side of that every thing works great till now,positive
"boAt Rockerz 510 Super Extra Bass Bluetooth Headset??????(Molten Orange, On the Ear)",1199,4,delightful,battery backup owsome using since one week and still its at 50 good smooth audio quality like sony design owsome and perfectly fit no pain over earcons dont go for this if you are bass lover like me jbl is best in that bass quality too poor,positive
"boAt Rockerz 510 Super Extra Bass Bluetooth Headset??????(Molten Orange, On the Ear)",1199,5,fabulous!,nice product value for money fanatic sound effect and bass but little bit need improvement in build quality nice package and design actually i dont have no more words to praise thanks to boat,positive
"boAt Rockerz 510 Super Extra Bass Bluetooth Headset??????(Molten Orange, On the Ear)",1199,5,best in the market!,i am using this product from last one month in starting i fill it a little heavier than another products but now i am used to it and find it very comfortable ear cups are of free size and fit for small large and medium sized overall it is a good purchase in this price segmenteven on youtube it is working fine but playing pubg and other games leaving time is 1 to 2 seconds,positive
"boAt Rockerz 510 Super Extra Bass Bluetooth Headset??????(Molten Orange, On the Ear)",1199,5,best in the market!,i just loved it the best part is battery works up to one week some time as i use it 2 hrs daily,positive
"boAt Rockerz 510 Super Extra Bass Bluetooth Headset??????(Molten Orange, On the Ear)",1199,5,fabulous!,you will be lost in this amazing music world moreover the battery is semiinfinitetakes long time to drain which is goodthis headphones helped me to relieve from the exam stress thank you boat for this wonderful headphones,positive
"boAt Rockerz 510 Super Extra Bass Bluetooth Headset??????(Molten Orange, On the Ear)",1199,5,fabulous!,osm headphones good quality plastic material is used bass is super cool you just love it,positive
"boAt Rockerz 510 Super Extra Bass Bluetooth Headset??????(Molten Orange, On the Ear)",1199,5,terrific purchase,after 2 month of purchase this headphonei reviewed about this amazing product at first i didnt like this headphone because of its size and thought its have low build quality but after using this headphone regularly i just love this headphone i prefer this for watching movies for bass lovers its heavenalso sounds good tooall vocals sound nice,positive
"boAt Rockerz 510 Super Extra Bass Bluetooth Headset??????(Molten Orange, On the Ear)",1199,5,super!,sound quality is good and bass is nice battery backup is awsome and tremendous me an average user 2 3 hr d getting a month usage of single charge thts really awesome,positive
"boAt Rockerz 510 Super Extra Bass Bluetooth Headset??????(Molten Orange, On the Ear)",1199,5,terrific purchase,excellent base very good battery nice and clear sound in this price u cant expect anything more really a grt product by boat lots of appreciation,positive
"boAt Rockerz 510 Super Extra Bass Bluetooth Headset??????(Molten Orange, On the Ear)",1199,4,wonderful,very good and solid build and battery is awesome sound quality is super,positive
"boAt Rockerz 510 Super Extra Bass Bluetooth Headset??????(Molten Orange, On the Ear)",1199,5,worth every penny,more than happy with its performance n its really comfortable noise cancellation is ok okoverall i m happy with ittotal value for moneygot it for 1250 bucks,positive
"boAt Rockerz 510 Super Extra Bass Bluetooth Headset??????(Molten Orange, On the Ear)",1199,5,mind-blowing purchase,got this headset 34 days late writing this review after a month totally worth the wait superb bass amazing battery life i play pubg battery lasts fr 3days u can make out enemy footstep directions different sound tho it says on the box 10hrs u gt more n more battery best budget headset i ever had,positive
"boAt Rockerz 510 Super Extra Bass Bluetooth Headset??????(Molten Orange, On the Ear)",1199,5,super!,best sound quality n awesome bass love it highly recommend for music lovers,positive
"boAt Rockerz 510 Super Extra Bass Bluetooth Headset??????(Molten Orange, On the Ear)",1199,4,delightful,battery back up is not as much as shown and sometime mike doesnt work while playing game but it looks stylish bass and sound quality is good and for listening music its excellent,positive
"boAt Rockerz 510 Super Extra Bass Bluetooth Headset??????(Molten Orange, On the Ear)",1199,5,must buy!,awesome value for money product specially since i got it on offer but its still worth 2k id saybass is the biggest plus point on this but you need good quality music other than that only the glossy part would be better with matte finish and it weighs more than the average headphone,positive
"boAt Rockerz 510 Super Extra Bass Bluetooth Headset??????(Molten Orange, On the Ear)",1199,5,must buy!,i am i bought this headphonepros1 awesome battery backup2 excellent connectivity range3 cushion is very nice4 wired connectivy gives even better performancecons1size is too big so i dont use it outside i use it only at home when playing pubg2 battery percentage is never accurate mostly shows 70 battery left3 wireless experience is great for listening dj songs or 8d songs but not that great to listen romantic songs like arijit singhs music,positive
"boAt Rockerz 510 Super Extra Bass Bluetooth Headset??????(Molten Orange, On the Ear)",1199,5,simply awesome,superb and attractive item i like it so much i dont have any words to say go for it rit now friends,positive
"boAt Rockerz 510 Super Extra Bass Bluetooth Headset??????(Molten Orange, On the Ear)",1199,5,best in the market!,the headphones indeed are one of the best in the price range the bass is good and battery power is really cool,positive
"boAt Rockerz 510 Super Extra Bass Bluetooth Headset??????(Molten Orange, On the Ear)",1199,4,pretty good,i am in love with this headphone sound quality top notch build quality could be mote better but its not a big deal if we see price then its justified you can bilndly go for it,positive
"boAt Rockerz 510 Super Extra Bass Bluetooth Headset??????(Molten Orange, On the Ear)",1199,4,pretty good,just good i buy for gaming use mostly for pubg bt little bit delay in sound and i will say wired headphones are the best for perfect audio quality its good if you just want listen songs not for pubg,positive
"boAt Rockerz 510 Super Extra Bass Bluetooth Headset??????(Molten Orange, On the Ear)",1199,5,perfect product!,it is a very good looking product and you can feel that the plastic and the built look very premium but i dont feel there is any extra bass in that the sound quality is ok but nothing impressive but the money what you are paying you are getting a excellent product,positive
"boAt Rockerz 510 Super Extra Bass Bluetooth Headset??????(Molten Orange, On the Ear)",1199,4,worth the money,it is used as two in one purpose like use it as bluetooth head set and also as a wired headset the base and sound clarity is awesome best for music and movie lovers,positive
"boAt Rockerz 510 Super Extra Bass Bluetooth Headset??????(Molten Orange, On the Ear)",1199,5,must buy!,such a wonderful product amazing basssssss and clarity worth of 17k really superb battery backup is so good still i saw 5 movies and heard 100 plus songs battery still 90 i didnt charge since buy the product,positive
"boAt Rockerz 510 Super Extra Bass Bluetooth Headset??????(Molten Orange, On the Ear)",1199,5,super!,for those who are bass lovers please ensure your mobile specifications once for some smart phones the bass in these headphones are not up to the mark so you can always apply the changes in audio settings and increase the bass quality as of for me its just awesome the battery life is way beyond expectation its been 4 days since i purchased it literally awesome go for it the bass quality is damn good,positive
